{
  "$schema": "https://json-schema.org/draft/2020-12/schema",
  "$id": "https://codebase-gardener.dev/schemas/first_report_fixture.schema.json",
  "type": "object",
  "required": ["repository_constitution", "analysis_snapshot", "entropy_report", "gardening_session_result", "maintenance_opportunities", "maintenance_pr_plans"],
  "properties": {
    "repository_constitution": { "$ref": "https://codebase-gardener.dev/schemas/repository_constitution.schema.json" },
    "analysis_snapshot": { "$ref": "https://codebase-gardener.dev/schemas/analysis_snapshot.schema.json" },
    "entropy_report": { "$ref": "https://codebase-gardener.dev/schemas/entropy_report.schema.json" },
    "gardening_session_result": { "$ref": "https://codebase-gardener.dev/schemas/gardening_session_result.schema.json" },
    "maintenance_opportunities": {
      "type": "array",
      "items": { "$ref": "https://codebase-gardener.dev/schemas/maintenance_opportunity.schema.json" }
    },
    "maintenance_pr_plans": {
      "type": "array",
      "items": { "$ref": "https://codebase-gardener.dev/schemas/maintenance_pr_plan.schema.json" }
    }
  },
  "additionalProperties": false
}
